comment,clean,label_manual,sentimen,sentiment_indobert,sentiment_indobert_kotor,sentiment_roberta,sentiment_roberta_kotor
Yg masih dalam status di proses apakah sudah pasti tidak lolos ya kk? Soalnya masih bingung status di proses ini apakah harus ikut kegiatan national onboarding ini atau ngga,status proses lolos bingung status proses giat national onboarding,1,Negatif,Negatif,Netral,neutral,negative
@rizkiagung.id gk ada yg rugi kalo ente gk ikut btw,rugi ente ngomong-ngomong,0,Netral,Negatif,Netral,positive,neutral
"@sonofspider semua penting, jangan anggap remeh setiap tahapan",anggap remeh tahap,0,Netral,Negatif,Netral,negative,neutral
@devsely tetap semangat% walaupun kita tidak lolos tenang yang penting kita udah berusaha mencoba sampai di titik akhir.,semangat lolos tenang usaha coba titik,2,Positif,Positif,Netral,positive,neutral
@mokhasxh terbaik lanjutkan brash moga betah di Makassar,baik lanjut brash moga betah makassar,1,Negatif,Positif,Positif,positive,positive
"Katanya mau meningkatkan kualitas pendidikan, masalah yg macem berkas & simulasi ujian aja banyak kendala.... Terus sistem pemilihan ga jelas banget mana ga ada admin yg nanggepin pertanyaan lebih mending CS tokped responsif, harusnya kalo inj diawal2 dikasih tau di SnK tentang jumlah kuota lah...percuma juga si komen di lapak sini, sulit di kontrol semoga hari mu me..............",tingkat kualitas didik berkas simulasi uji kendala sistem pilih banget admin tanggap lebih baik cs tokped responsif inj diawal2 kasih snk kuota lahpercuma komen lapak sulit kontrol moga mu me,0,Positif,Negatif,Negatif,neutral,negative
"@julius_trbb99 percuma bro, dari sekian banyak komentar, mimin nya tidak turun tangan menanggapi curhatan kita kita semua",saudara laki sekian komentar admin turun tangan tanggap curhatan,0,Netral,Netral,Negatif,neutral,negative
"@weyguh iya benar sekali kawan, harusnya panitia atau tim pelaksana bisa memperhatikan hal iniO",kawan panitia tim laksana perhati,2,Netral,Netral,Netral,neutral,negative
"Cung yang tiap hari nge cek platform MSIB sama email hingga sekarang ga ada kabar""",cung nge cek platform msib email kabar,0,Netral,Netral,Netral,neutral,negative
"Sabar ya gaes, ini masih tanggal 14 dan masih ada kesempatan ditanggal 15 sebelum tanggal 16 program dimulai L",sabar gaes tanggal sempat tanggal tanggal program,1,Netral,Positif,Netral,neutral,positive
"@julius_trbb99 setuju sihh, kalo diproses mulu kita kita yang berharap ini jadi serba salah, ada yg bilang gagal, ada yg bilang tunggu aja.",tuju proses melulu harap serba salah bilang gagal bilang tunggu,0,Negatif,Negatif,Negatif,negative,negative
"@samsul.arf21 bener banget, yang bisa rubah status tuh mitranya",banget rubah status tuh mitra,1,Positif,Negatif,Netral,negative,negative
"@rachel.marla protes ke mitranya, yang bisa ubah tuh mitra xoxo",protes mitra ubah tuh mitra xoxo,1,Netral,Negatif,Negatif,negative,negative
@devsely innallaha maashobirin yaa Ld,innallaha maashobirin,1,Netral,Positif,Netral,positive,positive
"@rasberryyeu_ di youtube kemarin aku ketemu kak, cari saja",youtube kemarin ketemu cari,1,Netral,Netral,Netral,neutral,neutral
"tolong untuk kedepan bagi yg sudah pernah mengikuti magang kampus merdeka tidak bisa ikut lagi, soalnya banyak temen-temen yg belum magang jadi ga lewat!!!",tolong depan ikut magang kampus merdeka tementemen magang,0,Netral,Netral,Negatif,neutral,negative
@bro.swryz yauda terima aja gausa koar2 disni,yauda terima enggak usah koar2,0,Netral,Negatif,Netral,neutral,negative
"@dekara.ninsa yee mbak.... Mencoba generalisasi kasus temen anda. Hati2 tanda2 distorsi kognitif butuh ke psikolog. Lihat kasus temen lain, argumen lain, tuntutan yang lain. See this as a whole.",coba generalisasi teman hati tanda2 distorsi kognitif butuh psikolog lihat teman argumen tuntut this as a whole,0,Positif,Negatif,Negatif,negative,negative
@azizmario_ gmn kita tau berkas itu eligible sm gak nya?,berkas eligible,1,Netral,Positif,Netral,positive,neutral
"@bro.swryz oh, sama kyk info beredar. Harus lapor kampus",oh kayak informasi edar lapor kampus,1,Netral,Negatif,Netral,neutral,negative
"@babu_abu_abu udah terakhir tanggal 27 bro lewat pic kampus""",tanggal saudara laki pic kampus,1,Netral,Negatif,Netral,neutral,negative
@anggafii_ tapi banyak yg offering tgl 13 loh. Gmn ga bingung kita,offering tanggal loh bingung,0,Negatif,Negatif,Netral,negative,negative
@bro.swryz kalo banding carany gmn bang?,banding carany,1,Netral,Negatif,Netral,neutral,negative
untuk mahasiswa disabilitas kok agak sulit ya,mahasiswa disabilitas sulit,0,Negatif,Negatif,Negatif,negative,negative
@zaki_na iih kesell brooooo wkwkwkw,ih kesell brooooo wkwkwkw,0,Netral,Negatif,Negatif,negative,negative
@bro.swryz udh bro gausah tanggepin tu orang,saudara laki enggak usah tanggepin orang,1,Netral,Negatif,Negatif,negative,negative
"@nyepammyy_ nggak kak,tapi aku udah offering cuman belum ada invite group sama sekali makanya aku nanya.Takut ketinggalan info.",kaktapi offering cuman invite group nanyatakut tinggal informasi,1,Positif,Netral,Negatif,neutral,negative
@kezyameystika_ Ditjen perumahan udah ada kabar ka?,ditjen rumah kabar,1,Positif,Netral,Netral,neutral,neutral
@yunpnzr Gue alumni magang batch 2p bahkann batch 1 gua juga hunter dan hampir lolos di stupen cuma waktu itu dikonfirmasi status semester gue masih kurang:) Jd gua paham banget seleksi msib itu gimana dan harusnya orang yg konsul ke gue. Menurut batch ini cenderung regres. Karena sosialisasinya kurang. Baca aja di twitter pakai hastag #RegulasiCacatMSIB4 udah dijelasin kronologinya kek mana. Kita juga paham dan ga ngasal protes karena kalau ga ada bukti sama aja omong kosong. Saya kasih tau ya mas. Status keluar tgl 30 itu yg mengeluarkan sistem bukan kampus. Jd proses seleksi ini ga ada hubungannya sama kampus. Semoga kamu paham dan jangan sesekali menormalisasi kesalahan lain untuk menjadi pembenaran atas kesalahan lainnya.,alumni magang batch bahkann batch hunter lolos stupen konfirmasi status semester paham banget seleksi msib orang konsultasi batch cenderung regres sosialisasi baca twitter pakai hastag regulasicacatmsib4 dijelasin kronologi kayak paham ngasal protes bukti omong kosong kasih status tanggal keluar sistem kampus proses seleksi hubung kampus moga paham normalisasi salah benar salah,0,Negatif,Negatif,Negatif,negative,negative
@rozindarrr ditjen perumahan sulawesi tenggara,ditjen rumah sulawesi tenggara,1,Positif,Netral,Netral,neutral,neutral
@kezyameystika_ mitra apa?,mitra,1,Netral,Positif,Netral,positive,neutral
"@bro.swryz lu reject berkas tapi offering? Gue nemu bug di sistem seleksi ini. Setau gue offering yang menentukan mitra, sedangkan berkas itu urusan tim MSIB. Kemungkinan nanti di pertengahan program lu bakal nemu masalah itupun kalo tim MSIB tegas buat nyuruh mitra cancel keikutsertaan mahasiswa yang berkasnya rejected. Klo urusan banding, dalam seleksi berkas itu yang ngecek bukan AI/bot tapi manusia (ini kalo CPNS). Jadi masalah mistake itu wajar, barangkali mata mereka sliwer jadi kita sebagai mahasiswa ya harus jeli sendiri klo ternyata ada salah dalam seleksi ya kita harus rajin follow up ke penyelenggara. Kalo masalah revisi berkas yang baru keluar di tanggal 30 Januari pdhl tanggal 27 Januari udah gak bisa direvisi ya itu urusan mahasiswa sama kampus, tim gak peduli sama kasus ini. Klo urusan info banding yang gak tersosialisasi dengan baik, kenapa peserta sebelumnya gak cari tau & bertanya waktu sosialisasi MSIB? Seinget gue dari pihak MSIB maupun kampus juga ngadain sosialisasi MSIB deh. Trus rajin tanya ke alumni MSIB di kampus masing-masing prosesnya gimana, fiturnya apa aja. Walaupun tahapannya beda tapi kan tetep ada namanya surbin, sr, sptjm, dll. Bagi gue program ini masih baru jadi masih banyak bug. Jangankan ini, CPNS aja sering bermasalah kok tahapannya",reject berkas offering nemu bug sistem seleksi tau offering tentu mitra berkas urus tim msib tengah program nemu itu tim msib nyuruh mitra cancel keikutsertaan mahasiswa berkas rejected urus banding seleksi berkas ecek aibot manusia cpns mistake wajar barangkali mata sliwer mahasiswa jeli salah seleksi rajin follow up selenggara revisi berkas tanggal januari tanggal januari revisi urus mahasiswa kampus tim peduli urus informasi banding sosialisasi serta cari sosialisasi msib seinget msib kampus ada sosialisasi msib deh rajin alumni msib kampus masingmasing proses fiturnya tahap beda nama surbin sr sptjm dan lain program bug cpns masalah tahap,0,Negatif,Negatif,Negatif,neutral,negative
"Bagi tips kak tahun depan saya coba, yang lulus bagi tips dong",tips coba lulus tips,1,Netral,Netral,Netral,neutral,neutral
disini ada yang udh diterima magang KAKA MENTOR INAmikro?,terima magang mentor inamikro,1,Netral,Netral,Netral,positive,neutral
@bro.swryz udh bro gausah ditanggepin orang itu... Biar dia pada statemennya,saudara laki enggak usah ditanggepin orang biar statemennya,1,Netral,Negatif,Negatif,negative,negative
@nanasealfayeed gue udah reject aja masih dapet offering ketrima,reject offering terima,1,Netral,Negatif,Netral,neutral,negative
Yng udah offering diweb tetapi dbatalin gjadi offering gara2 berkas gak eliglibe cungF5,offering diweb dbatalin gjadi offering gara-gara berkas eliglibe cung,1,Netral,Negatif,Negatif,neutral,negative
"@yunpnzr Hadeh, udah dijelasin masih aja denial. Poinnya adalah kita menuntut keadilan soal seleksi berkas ini. Ada peserta yang awalnya direject lalu banding. Banding itu bukan revisi tapi recheck berkas karena merasa ga ada salah. Dan beberapa dari mereka khususnya di mitra gue ada 7 orang yang lolos banding. Logikanya brati berkas mereka yang tadinya dianggep salah itu seharusnya bener setelah didechek sama tim verifikasi msib. Sampai sini paham? Tapi kondisi di lapangan info banding ini tidak dideliver dengan baik dan ga semua peserta bisa ngajuin banding. Itu poinnya kenapa pada protes.",hadeh dijelasin denial poin tuntut adil seleksi berkas serta direject banding banding revisi recheck berkas salah mitra orang lolos banding logika brati berkas dianggep salah didechek tim verifikasi msib paham kondisi lapang informasi banding dideliver serta aju banding poin protes,0,Positif,Negatif,Negatif,neutral,negative
"Alhamdulillah, semoga dilancarkan untuk kita semua hingga graduation nanti L",alhamdulillah moga lancar graduation,2,Negatif,Positif,Positif,positive,positive
"@yunpnzr Lah kok balik tanya, hubungannya kampus sama proses seleksi berkas apaan? Jawab dulu. Malah meleber ke yang lain",hubung kampus proses seleksi berkas leber,1,Netral,Netral,Negatif,neutral,negative
"@bro.swryz dan apalagi yang gak ikut interview dan test apa2 tau2 di website keterima, lebih lawak si hahahah",interview test apa tau website terima lawak hahahah,0,Netral,Negatif,Positif,neutral,negative
"Dahalh, gw sampe mimpi ,gak keterima. deg deg setiap harus tpi gk dpt e-mail apa. *",dahalh mimpi terima deg deg email,1,Netral,Positif,Negatif,neutral,negative
@ryanh_aldebaran sotau,sotau,0,Netral,Positif,Netral,negative,neutral
@dekara.ninsa nah waktu gue ikut tes CPNS banyak kasus yang gak lolos administrasi tapi gak jelas gagal dimana. Pas di cek lah ada pemalsuan dokumen. Kata gue untung aja gak kena jeratan hukum ,tes cpns lolos administrasi gagal mana pas cek palsu dokumen untung kena jerat hukum,0,Negatif,Negatif,Negatif,neutral,negative
@bro.swryz btw ente pernah ikut seleksi pemerintah gak? Serius nanya,ngomong-ngomong ente seleksi perintah serius,1,Negatif,Negatif,Netral,positive,negative
"@_andrieseprian sabarrrr""""",sabarrrr,2,Netral,Positif,Netral,positive,positive
Ada yang sama nggak dengan aku udah offering dari tanggal 6 tapi sampai sekarang belum ada invite group atau informasi selanjutnya gimana padahal aku magang di luar kota.Mohon penjelasannya minO @magangmerdeka,offering tanggal invite group informasi magang kotamohon jelas,1,Positif,Netral,Netral,neutral,negative
"@dekara.ninsa Kalau keterangan dari msib dan dr kampus, Banding itu bukan revisi tapi recheck ulang dokumen, jd yg diunggah itu dokumen yg sama dengan di platform. Justru katanya kalau berusaha merevisi dokumen bakalan di blacklist",terang msib kampus banding revisi recheck ulang dokumen unggah dokumen platform usaha revisi dokumen blacklist,1,Positif,Netral,Negatif,neutral,negative
"@denifebriansyh iya kak, bebal bgt tuh mereka, gue sejak batch 2 smpe skrg belum kesempatan ya Krn pihak msib kaya selalu tutup mata tutup telinga. Gak sigap nginfoin, terkesan seadanya dan ga profesional. Web nya pun gitu gabisa buat tinjau berkas.",bebal banget tuh batch sempat msib kayak tutup mata tutup telinga sigap nginfoin kes ada profesional web enggak bisa tinjau berkas,0,Positif,Negatif,Negatif,negative,negative
"@andir1_ ngga kak memang masih proses tadi pagi ada balasan email dari kampus merdeka kalau proses seleksi MSIB masih berlangsung, dsrh menunggu dluO",proses pagi balas email kampus merdeka proses seleksi msib dsrh tunggu,1,Netral,Netral,Netral,neutral,neutral
@bro.swryz dia ngerubah isi doc ga bro? Biasanya dia tau salahnya dimana. Makanya reupload ulang.,ngerubah isi doc saudara laki salah mana reupload ulang,1,Negatif,Negatif,Netral,neutral,negative
berarti proses seleksi ga tranparan dong? klo pihak kampus merdeka udh nyeleksi dan mengadakan aju banding berkas kenapa ga disebar secara merata dan penutupan aju banding cepet dari tanggal pembukaan? banyak temen temen yg lain bilang ini permasalahan dari batch 1 sampe skrng dan ga berubah dari dulu,proses seleksi tranparan kampus merdeka nyeleksi ada aju banding berkas sebar rata tutup aju banding cepat tanggal buka teman teman bilang masalah batch ubah,0,Negatif,Negatif,Negatif,neutral,negative
@j.ilhamp itu gk llus bro. Kbtulan ini thun ke 2 gw ikut tpi masih sama jga dgn thum sblmnya,llus saudara laki kbtulan thum,1,Netral,Negatif,Negatif,neutral,negative
"@adhlslsa itu ditolak, kak",tolak,0,Netral,Negatif,Negatif,negative,negative
"@dekara.ninsa Yang emang lalai itu ada, tp gabisa digeneralisasi juga semua yang salah itu karena lalai dan sengaja salah. Buktinya ada kok yg habis banding bisa verified. Brati ada kemungkinan pengecekan pertana itu kesalahan dr pihak verifikasi kan? Info banding ga semua dapet karena ada yg baru tau berkasnya setelah tgl 27 yg mana banding udah ditutup",lalai enggak bisa generalisasi salah lalai sengaja salah bukti habis banding verified brati kece pertana salah verifikasi informasi banding berkas tanggal banding tutup,0,Negatif,Negatif,Negatif,negative,negative
Kesempatan aku udah hilang r,sempat hilang,0,Netral,Negatif,Negatif,negative,negative
@_erlanggadwiputra materainya nyomot google kaga? Ttdnya tempelan kaga? Temen gw kek gitu soalnya.,materainya nyomot google ttdnya tempel teman kayak,0,Netral,Negatif,Negatif,neutral,negative
"@3721________ ada tutor di yutub kak, itu terbukti bisa karena saya dikonfirmasi mitra juga klu verkasnya ada yg salah",tutor yutub bukti konfirmasi mitra verkasnya salah,1,Netral,Netral,Netral,neutral,neutral
"@bro.swryz temen gw ngotot bgt berkas dia bener. Sampe protes marah marah. Pas gw cek ternyata materai dia nyomot dari google. Yaa jelas ga lolos lah. Ini salah satu contoh ada org ngotot berkas bener. Tapi ga peduliin point materai, ttd dsb itu penting.",teman ngotot banget berkas protes marah marah pas cek materai nyomot google lolos salah contoh orang ngotot berkas peduli point materai ttd dsb,0,Negatif,Negatif,Negatif,negative,negative
@devsely cara cek dokumen kita itu eligible gimana yaa kak?,cek dokumen eligible,1,Netral,Netral,Netral,neutral,neutral
@_erlanggadwiputra cara cek dokumen kita itu eligible gimana yaa?,cek dokumen eligible,1,Netral,Netral,Netral,neutral,neutral
"@yunpnzr 79K mas, gak usah asal bunyi lagi dahh, jumlah peserta aja salah",79k bunyi deh serta salah,0,Negatif,Negatif,Netral,negative,negative
"@yunpnzr ya mas, mitra ama PIC kampus aja gk bisa bantu ngecekin. Justru itu yg kita tuntut, transparansi biar dicek apa salah upload. Klu dicek ya baik2 aja filenya lebih better berkasku dibanding temenku yg gak nyantumin ttd ama kop.",mitra pic kampus bantu ngecekin tuntut transparansi biar cek salah upload cek baik filenya better berkas banding temenku nyantumin ttd kop,0,Netral,Negatif,Negatif,neutral,negative
"ngurus berkas sulitnya minta ampun, eh gada kbr",urus berkas sulit ampun eh enggak ada kabar,0,Negatif,Negatif,Negatif,negative,negative
@adrian_wbsn kalo ga di Terima minimal kasih kabar biar nggak berharap. btw saya juga korban,terima minimal kasih kabar biar harap ngomong-ngomong korban,0,Negatif,Negatif,Negatif,neutral,negative
Buat adik2 diinget2 ya buat batch/tahun depan. Brightness materai > CV & kualifikasi,adik2 diinget2 batchtahun brightness materai cv kualifikasi,1,Netral,Netral,Netral,neutral,neutral
"@denifebriansyh kalo feeling gw (belum tentu benar), yang nyeleksi sr sama sptjm nya kampus merdeka bro. Mitra itu bisa liat berkas sisanya (cv dll).",feeling nyeleksi sr sptjm kampus merdeka saudara laki mitra lihat berkas sisa cv dan lain,2,Netral,Netral,Netral,neutral,neutral
"gua dapet undangan dr mitra bro, udh dimasukin grupnya lgi. Proses seleksi berkas itu eligible atau ngga itu dimitra ato dr pihak kampus merdeka? status SR reject lo. Itu berkas di seleksi dibagian apa coba?",undang mitra saudara laki masuk grup proses seleksi berkas eligible mitra kampus merdeka status sr reject berkas seleksi bagi coba,1,Netral,Netral,Netral,neutral,negative
@hshshdoang onboarding prushaan tgl 16 leh nak ato?,onboarding prushaan tanggal nak,1,Netral,Negatif,Netral,negative,neutral
"bangun pemuda-pemudi, Indonesia :"")",bangun pemudapemudi indonesia,1,Netral,Netral,Netral,neutral,neutral
"@j.ilhamp patokannya itu bukan dari status website, tapi dari lu dapet undangan (wa/email) dari mitra buat recruitment process selanjutnya (entah itu tes, intv, atau apapun). Selama gak ada undangan recruitment process selanjutnya, berarti gausah berharap. Arti status diproses di website itu artinya mitra sudah liat dokumen lu",patok status website undang waemail mitra recruitment process tes intv apa undang recruitment process enggak usah harap arti status proses website mitra lihat dokumen,1,Netral,Netral,Netral,neutral,negative
Kabarnya sampai kiamat di proses terus kak :<,kabar kiamat proses,0,Netral,Negatif,Netral,negative,negative
"@adrian_wbsn patokannya itu bukan dari status website bro, tapi dari dapet atau tidaknya undangan recruitment process dari mitra (entah itu tes, interview, atau apapun itu). Kalo gak dapat undangan buat lanjut recruitment ke tahap selanjutnya berarti gak lolos. Status di website diproses itu artinya dokumen lu udah dilihat dan masuk ke proses seleksi oleh mitra.",patok status website saudara laki tidak undang recruitment process mitra tes interview apa undang recruitment tahap lolos status website proses dokumen masuk proses seleksi mitra,0,Netral,Negatif,Netral,neutral,negative
"@arthasth._ setauku yg bisa ngerubah status dari sudah daftar -> proses -> diterima, itu urusan masing2 mitra melalui tim recruiter mereka. denger2 kalo emg ada yg ga lolos tim recruiter mls buat ngerubah status ke tidak lolos mengingat banyaknya yg daftar.",tau ngerubah status daftar proses terima urus mitra tim recruiter denger2 lolos tim recruiter malas ngerubah status lolos banyak daftar,0,Positif,Negatif,Negatif,negative,negative
"Setidaknya di bagian kegiatan tempat magang di kasih tulisan tdk lolos, biar kami para pendaftar lainnya tdk terantung begini,,, klo tertulis proses kami berspekulasi bahwa masih ada harapan atau masih proses pendaftarn / seleksi,,, panitia mohon di baca dan klarifikasi dong,,, semua anak muda indonesia butuh kesamaan jangan hanya di pilih2 ,, klo pilih2 begini mau taruh dimana sila pancasila yang hari2 di baca ulang2 ,, percuma saja",giat magang kasih tulis lolos biar daftar terantung tulis proses spekulasi harap proses pendaftarn seleksi panitia mohon baca klarifikasi anak muda indonesia butuh sama pilih2 pilih2 taruh mana sila pancasila hari baca ulang2,0,Positif,Negatif,Negatif,neutral,negative
"@nadiemmakarim dengan segala hormat pak menteri, mungkin bisa disesuaikan lagi programnya berdasarkan hasil evaluasi di periode ini semoga bisa menjadi lebih baik lagiO",hormat menteri sesuai program dasar hasil evaluasi periode moga,2,Netral,Netral,Netral,neutral,neutral
kasih kejelasan klo emng di tolak.,kasih jelas tolak,0,Positif,Negatif,Netral,neutral,negative
@rachel.marla iya kasian statusnya diproses aja gada kejelasan,kasihan status proses enggak ada jelas,0,Negatif,Negatif,Negatif,negative,negative
@bro.swryz aneh dan mengsedih,aneh mengsedih,0,Negatif,Negatif,Negatif,negative,negative
"@myvatnash Gua bingung sama responnya dia, kok tiba2 sampe kampus apa hubungannya-",bingung responnya kampus hubung,0,Negatif,Negatif,Negatif,neutral,negative
@yunpnzr Hah? Lu daftar msib ga si? Hubungannya sama kampus apaan? Kaget gua jawabannya kaga nyambungy,hah daftar msib hubung kampus kaget jawab sambung,0,Negatif,Negatif,Negatif,neutral,negative
"@yunpnzr status berkas keluar tbtb ga eligible itu karena dari sistemnya yang tbtb berubah, bukan dari kampus tbtb ngeluarin status wkk",status berkas tbtb eligible sistem tbtb ubah kampus tbtb keluar status wkk,1,Netral,Netral,Negatif,neutral,negative
@_erlanggadwiputra udah bangggg--,bangggg,1,Netral,Negatif,Netral,negative,positive
ga cakap intelektual ni penyelenggara...,cakap intelektual selenggara,0,Positif,Positif,Negatif,neutral,neutral
"3 bulan mati matian persiapan, tp yg lolos cuma modal berkas eligible, bukan skill yg diliat harusnya urusan berkas di filter di awall",mati mati siap lolos modal berkas eligible skill urus berkas filter awall,0,Positif,Negatif,Negatif,negative,negative
"@bro.swryz ya kalo urusan berkas itu mah urusan mahasiswa sama kampus mas. Penyelenggara gak peduli, gampangnya salah sendiri ngeluarinnya diluar dari jadwal. Itu udah resiko masing-masing ditanggung peserta. Gak sekalian lu nuntut pendaftaran & revisi sampe tanggal 31 Desember 2023?",urus berkas mah urus mahasiswa kampus selenggara peduli gampang salah ngeluarinnya luar jadwal resiko masingmasing tanggung serta tuntut daftar revisi tanggal desember,0,Positif,Negatif,Negatif,negative,negative
"Bener banget, serasa di gantungin astaga udah penuh harapan tapi kalau kaya gini langsung down C",banget serasa gantungin astaga penuh harap kayak langsung down,0,Positif,Negatif,Negatif,negative,negative
@rachel.marla semisal lwt dri tgl 11 kemungkinan udh ga lolos mas,tanggal lolos,1,Netral,Netral,Netral,neutral,negative
@adrian_wbsn bner nih broth?,broth,1,Netral,Positif,Netral,negative,neutral
@yunpnzr Baru dari mananya bro? udah batch 4 lho. Kalau ada orang kritik membangun itu diterima dan dijadikan masukkan bukan malah menormalisasi kesalahan. Hadeh,mana saudara laki batch lho orang kritik bangun terima jadi masuk normalisasi salah hadeh,2,Netral,Negatif,Negatif,negative,negative
"@ ya baguslah, soalnya saya baca komen dari kmrn sih, keluhan mereka yang sma sma mengurus tp salah satunya ga eligible",bagus baca komen kemarin keluh urus salah satu eligible,2,Netral,Positif,Positif,negative,negative
Kecewa gk lg lg deh ikutan kalau sistem nya masih seperti ini,kecewa deh ikut sistem,0,Negatif,Negatif,Negatif,negative,negative
Kasih kejelasan setidaknua buat tidak lolos,kasih jelas setidaknua lolos,1,Positif,Positif,Negatif,positive,neutral
"@yunpnzr Lha memang ada kesalahan, makanya pada protes. Ga semua banding dicek banyak yg statusnya masih on review sampe sekarang. Bahkan ada yang status berkasnya baru keluar tanggal 30 sedangkan banding udah ditutup tgl 27. Trus mau gimana kalau gitu?",salah protes banding cek status on review status berkas tanggal banding tutup tanggal,0,Negatif,Negatif,Negatif,neutral,negative
@tntkswl_ Malee bgt bgsddd mandang kampus wkwkwkwk,malee banget bgsddd mandang kampus wkwkwkwk,0,Positif,Negatif,Negatif,negative,negative
"@babu_abu_abu namanya juga program masih baru, resiko ditanggung pendaftar. Jangan kaget diginiin, karna pas lu udah lulus kuliah lebih gak jelas lagi sistem seleksinya. Jadi anggap aja ini simulasi seleksi bertahan hidupO",nama program resiko tanggung daftar kaget begini pas lulus kuliah sistem seleksi anggap simulasi seleksi tahan hidup,0,Netral,Negatif,Negatif,neutral,negative
"@herdodp kurang tau kalau bangkit, tapi yang pasti kalau bangkit, yang ga lolos tetep nerima email informasi ga lolos",bangkit bangkit lolos terima email informasi lolos,0,Netral,Netral,Negatif,neutral,negative
@gastrovast tgl 16 masih pembekalan??,tanggal bekal,1,Netral,Negatif,Netral,neutral,neutral
"@bro.swryz ya berarti kalo begitu ada kesalahan cek berkas. Kan yang di cek gak cuma ente doang. Animonya aja sampe ratusan ribu peserta loh. Kalo gitu balik lagi ke pesertanya, kenapa gak mau aju banding kalo ada kesalahan? L",salah cek berkas cek ente doang animo ratus ribu serta loh serta aju banding salah l,0,Negatif,Negatif,Negatif,neutral,negative
@babu_abu_abu Banyak yang banding dan berubah jadi verified. Brati ada kemungkinan di verifikasi pertama ada miss dr sistemnya. Kenapa orang pada denial ya kak:((,banding ubah verified brati verifikasi miss sistem orang denial,0,Netral,Netral,Negatif,neutral,negative
@herdodp ga ada kak Bangkit,bangkit,1,Netral,Positif,Negatif,negative,negative
@adrian_wbsn sediih amatr,sediih,0,Netral,Positif,Netral,positive,positive
MSIB batch 4 kacau. Minimal kasih kejelasan kepada mahasiswa,msib batch kacau minimal kasih jelas mahasiswa,0,Negatif,Negatif,Negatif,negative,negative
"@adhlslsa berasa dighosting""",asa dighosting,0,Netral,Negatif,Positif,neutral,negative
@adrian_wbsn wkwkw asliii kak,wkwkw asli,1,Positif,Positif,Netral,positive,neutral
"Masak ,dh sampai tgl 13 masi di proses Mulu , setidaknya di kasih tau ,lolos apa enggak nya",masak deh tanggal proses melulu kasih lolos,0,Negatif,Netral,Netral,negative,negative
